<?xml version="1.0" encoding="UTF-8"?>

<!--
  -  Copyright (C) 2016 James E. Stark
  -
  -  This program is free software: you can redistribute it and/or modify
  -  it under the terms of the GNU General Public License as published by
  -  the Free Software Foundation, either version 3 of the License, or
  -  (at your option) any later version.
  -
  -  This program is distributed in the hope that it will be useful,
  -  but WITHOUT ANY WARRANTY; without even the implied warranty of
  -  MERCHANTABILITY or FITNESS FOR A PARTICULAR PURPOSE.  See the
  -  GNU General Public License for more details.
  -
  -  You should have received a copy of the GNU General Public License
  -  along with this program.  If not, see <http://www.gnu.org/licenses/>.
  -->

<!-- Sample Profile for the scratch data-store -->

<profile xmlns="http://icc.socs.uoguelph.ca/edm" xmlns:xsi="http://www.w3.org/2001/XMLSchema-instance"
	xsi:schemaLocation="http://icc.socs.uoguelph.ca/edm Profile.xsd">
	<name>mem</name>
	<mutable>true</mutable>

	<!--
	  -  Default Element and IdGenerator implementations.  These should not need
	  -  to be changed.
	  -->

	<element class="ca.uoguelph.socs.icc.edm.domain.Element">
		<generator>ca.uoguelph.socs.icc.edm.domain.datastore.idgenerator.SequentialIdGenerator</generator>
	</element>
	<element class="ca.uoguelph.socs.icc.edm.domain.Action">
		<implementation>ca.uoguelph.socs.icc.edm.domain.element.ActionData</implementation>
	</element>
	<element class="ca.uoguelph.socs.icc.edm.domain.ActivityReference">
		<implementation>ca.uoguelph.socs.icc.edm.domain.element.ActivityReferenceData</implementation>
	</element>
	<element class="ca.uoguelph.socs.icc.edm.domain.ActivitySource">
		<implementation>ca.uoguelph.socs.icc.edm.domain.element.ActivitySourceData</implementation>
	</element>
	<element class="ca.uoguelph.socs.icc.edm.domain.ActivityType">
		<implementation>ca.uoguelph.socs.icc.edm.domain.element.ActivityTypeData</implementation>
	</element>
	<element class="ca.uoguelph.socs.icc.edm.domain.Course">
		<implementation>ca.uoguelph.socs.icc.edm.domain.element.CourseData</implementation>
	</element>
	<element class="ca.uoguelph.socs.icc.edm.domain.Enrolment">
		<generator>ca.uoguelph.socs.icc.edm.domain.datastore.idgenerator.RandomIdGenerator</generator>
		<implementation>ca.uoguelph.socs.icc.edm.domain.element.EnrolmentData</implementation>
	</element>
	<element class="ca.uoguelph.socs.icc.edm.domain.Grade">
		<implementation>ca.uoguelph.socs.icc.edm.domain.element.GradeData</implementation>
	</element>
	<element class="ca.uoguelph.socs.icc.edm.domain.LogEntry">
		<implementation>ca.uoguelph.socs.icc.edm.domain.element.LogData</implementation>
	</element>
	<element class="ca.uoguelph.socs.icc.edm.domain.Network">
		<implementation>ca.uoguelph.socs.icc.edm.domain.element.NetworkData</implementation>
	</element>
	<element class="ca.uoguelph.socs.icc.edm.domain.Role">
		<implementation>ca.uoguelph.socs.icc.edm.domain.element.RoleData</implementation>
	</element>
	<element class="ca.uoguelph.socs.icc.edm.domain.User">
		<implementation>ca.uoguelph.socs.icc.edm.domain.element.UserData</implementation>
	</element>
</profile>
